{
  "task_id": "20260209T073959Z_compute_wolfram_demo",
  "skill": "compute",
  "backend": "wolfram",
  "work_compute_dir": "AGENTS/tasks/20260209T073959Z_compute_wolfram_demo/work/compute",
  "files_written": [
    "AGENTS/tasks/20260209T073959Z_compute_wolfram_demo/work/compute/spec.yaml",
    "AGENTS/tasks/20260209T073959Z_compute_wolfram_demo/work/compute/sanity_checks.md",
    "AGENTS/tasks/20260209T073959Z_compute_wolfram_demo/work/compute/compute_report_template.md",
    "AGENTS/tasks/20260209T073959Z_compute_wolfram_demo/review/compute_skill_report.md",
    "AGENTS/tasks/20260209T073959Z_compute_wolfram_demo/deliverable/compute/files_manifest.json",
    "AGENTS/tasks/20260209T073959Z_compute_wolfram_demo/logs/commands.txt",
    "AGENTS/tasks/20260209T073959Z_compute_wolfram_demo/logs/compute.stdout.log",
    "AGENTS/tasks/20260209T073959Z_compute_wolfram_demo/logs/compute.stderr.log",
    "AGENTS/tasks/20260209T073959Z_compute_wolfram_demo/logs/git_status.txt",
    "AGENTS/tasks/20260209T073959Z_compute_wolfram_demo/work/compute/main.wl"
  ],
  "status": "ok",
  "notes": "Generated deterministic compute scaffold with reproducibility hooks."
}
